[
  {
    "orderID": 0,
    "customerID": 4910,
    "toppings": [
      "pepperoni",
      "olive"
    ],
    "size": "L",
    "orderType": "phone",
    "destination": "pickup"
  },
  {
    "orderID": 1,
    "customerID": 33312,
    "toppings": [
      "ham",
      "pineapple"
    ],
    "size": "S",
    "orderType": "website",
    "destination": "delivery"
  },
  {
    "orderID": 2,
    "customerID": 818282,
    "toppings": [
      "anchovy",
      "jalepeno"
    ],
    "size": "M",
    "orderType": "phone",
    "destination": "pickup"
  },
  {
    "orderID": 3,
    "customerID": 999,
    "toppings": [
      "pepperoni",
      "bacon"
    ],
    "size": "L",
    "orderType": "phone",
    "destination": "delivery"
  }
]